{
  "updated_at": "2026-04-08T20:34:57+08:00",
  "source": "Tushare sw_daily + index_daily(000906.SH)",
  "stale_after_minutes": 1440,
  "status": "ok",
  "status_message": "已生成 5 个可用行业面板，0 个部分可用，0 个失败，1 个占位条目待后续补充。",
  "series": [
    {
      "board_id": "real-estate",
      "ts_code": "801180.SI",
      "label": "申万地产",
      "source": "Tushare sw_daily",
      "benchmark_code": "000906.SH",
      "benchmark_label": "中证800",
      "latest_trade_date": "2026-04-08",
      "dates": [
        "2025-04-07",
        "2025-04-08",
        "2025-04-09",
        "2025-04-10",
        "2025-04-11",
        "2025-04-14",
        "2025-04-15",
        "2025-04-16",
        "2025-04-17",
        "2025-04-18",
        "2025-04-21",
        "2025-04-22",
        "2025-04-23",
        "2025-04-24",
        "2025-04-25",
        "2025-04-28",
        "2025-04-29",
        "2025-04-30",
        "2025-05-06",
        "2025-05-07",
        "2025-05-08",
        "2025-05-09",
        "2025-05-12",
        "2025-05-13",
        "2025-05-14",
        "2025-05-15",
        "2025-05-16",
        "2025-05-19",
        "2025-05-20",
        "2025-05-21",
        "2025-05-22",
        "2025-05-23",
        "2025-05-26",
        "2025-05-27",
        "2025-05-28",
        "2025-05-29",
        "2025-05-30",
        "2025-06-03",
        "2025-06-04",
        "2025-06-05",
        "2025-06-06",
        "2025-06-09",
        "2025-06-10",
        "2025-06-11",
        "2025-06-12",
        "2025-06-13",
        "2025-06-16",
        "2025-06-17",
        "2025-06-18",
        "2025-06-19",
        "2025-06-20",
        "2025-06-23",
        "2025-06-24",
        "2025-06-25",
        "2025-06-26",
        "2025-06-27",
        "2025-06-30",
        "2025-07-01",
        "2025-07-02",
        "2025-07-03",
        "2025-07-04",
        "2025-07-07",
        "2025-07-08",
        "2025-07-09",
        "2025-07-10",
        "2025-07-11",
        "2025-07-14",
        "2025-07-15",
        "2025-07-16",
        "2025-07-17",
        "2025-07-18",
        "2025-07-21",
        "2025-07-22",
        "2025-07-23",
        "2025-07-24",
        "2025-07-25",
        "2025-07-28",
        "2025-07-29",
        "2025-07-30",
        "2025-07-31",
        "2025-08-01",
        "2025-08-04",
        "2025-08-05",
        "2025-08-06",
        "2025-08-07",
        "2025-08-08",
        "2025-08-11",
        "2025-08-12",
        "2025-08-13",
        "2025-08-14",
        "2025-08-15",
        "2025-08-18",
        "2025-08-19",
        "2025-08-20",
        "2025-08-21",
        "2025-08-22",
        "2025-08-25",
        "2025-08-26",
        "2025-08-27",
        "2025-08-28",
        "2025-08-29",
        "2025-09-01",
        "2025-09-02",
        "2025-09-03",
        "2025-09-04",
        "2025-09-05",
        "2025-09-08",
        "2025-09-09",
        "2025-09-10",
        "2025-09-11",
        "2025-09-12",
        "2025-09-15",
        "2025-09-16",
        "2025-09-17",
        "2025-09-18",
        "2025-09-19",
        "2025-09-22",
        "2025-09-23",
        "2025-09-24",
        "2025-09-25",
        "2025-09-26",
        "2025-09-29",
        "2025-09-30",
        "2025-10-09",
        "2025-10-10",
        "2025-10-13",
        "2025-10-14",
        "2025-10-15",
        "2025-10-16",
        "2025-10-17",
        "2025-10-20",
        "2025-10-21",
        "2025-10-22",
        "2025-10-23",
        "2025-10-24",
        "2025-10-27",
        "2025-10-28",
        "2025-10-29",
        "2025-10-30",
        "2025-10-31",
        "2025-11-03",
        "2025-11-04",
        "2025-11-05",
        "2025-11-06",
        "2025-11-07",
        "2025-11-10",
        "2025-11-11",
        "2025-11-12",
        "2025-11-13",
        "2025-11-14",
        "2025-11-17",
        "2025-11-18",
        "2025-11-19",
        "2025-11-20",
        "2025-11-21",
        "2025-11-24",
        "2025-11-25",
        "2025-11-26",
        "2025-11-27",
        "2025-11-28",
        "2025-12-01",
        "2025-12-02",
        "2025-12-03",
        "2025-12-04",
        "2025-12-05",
        "2025-12-08",
        "2025-12-09",
        "2025-12-10",
        "2025-12-11",
        "2025-12-12",
        "2025-12-15",
        "2025-12-16",
        "2025-12-17",
        "2025-12-18",
        "2025-12-19",
        "2025-12-22",
        "2025-12-23",
        "2025-12-24",
        "2025-12-25",
        "2025-12-26",
        "2025-12-29",
        "2025-12-30",
        "2025-12-31",
        "2026-01-05",
        "2026-01-06",
        "2026-01-07",
        "2026-01-08",
        "2026-01-09",
        "2026-01-12",
        "2026-01-13",
        "2026-01-14",
        "2026-01-15",
        "2026-01-16",
        "2026-01-19",
        "2026-01-20",
        "2026-01-21",
        "2026-01-22",
        "2026-01-23",
        "2026-01-26",
        "2026-01-27",
        "2026-01-28",
        "2026-01-29",
        "2026-01-30",
        "2026-02-02",
        "2026-02-03",
        "2026-02-04",
        "2026-02-05",
        "2026-02-06",
        "2026-02-09",
        "2026-02-10",
        "2026-02-11",
        "2026-02-12",
        "2026-02-13",
        "2026-02-24",
        "2026-02-25",
        "2026-02-26",
        "2026-02-27",
        "2026-03-02",
        "2026-03-03",
        "2026-03-04",
        "2026-03-05",
        "2026-03-06",
        "2026-03-09",
        "2026-03-10",
        "2026-03-11",
        "2026-03-12",
        "2026-03-13",
        "2026-03-16",
        "2026-03-17",
        "2026-03-18",
        "2026-03-19",
        "2026-03-20",
        "2026-03-23",
        "2026-03-24",
        "2026-03-25",
        "2026-03-26",
        "2026-03-27",
        "2026-03-30",
        "2026-03-31",
        "2026-04-01",
        "2026-04-02",
        "2026-04-03",
        "2026-04-07",
        "2026-04-08"
      ],
      "close": [
        1870.99,
        1911.96,
        1996.06,
        2040.02,
        2019.99,
        2023.97,
        2006.61,
        2010.36,
        2057.05,
        2088.6,
        2078.99,
        2096.51,
        2067.48,
        2073.75,
        2061.25,
        1985.71,
        1987.19,
        1998.59,
        2021.08,
        2042.45,
        2039.74,
        2006.78,
        2019.97,
        2014.36,
        2025.25,
        2001.7,
        2000.54,
        2035.57,
        2033.24,
        2022.52,
        1994.41,
        1971.22,
        1975.29,
        1987.64,
        1974.18,
        1993.04,
        1989.86,
        1983.77,
        2003.49,
        2004.34,
        2006.95,
        2008.13,
        2001.4,
        2013.73,
        2002.62,
        1971.62,
        2008.08,
        2002.21,
        1975.24,
        1939.73,
        1938.26,
        1949.48,
        1973.65,
        2001.28,
        1992.63,
        1997.82,
        2008.35,
        2001.37,
        2012.38,
        2012.16,
        2003.54,
        2037.17,
        2057.08,
        2056.89,
        2122.6,
        2126.08,
        2098.56,
        2078.0,
        2071.98,
        2070.11,
        2080.0,
        2098.62,
        2121.43,
        2110.68,
        2151.03,
        2164.62,
        2171.75,
        2179.09,
        2161.72,
        2093.78,
        2090.3,
        2092.0,
        2115.95,
        2118.54,
        2135.92,
        2135.43,
        2161.81,
        2176.82,
        2185.61,
        2173.7,
        2219.49,
        2209.2,
        2223.95,
        2227.49,
        2221.01,
        2230.67,
        2304.7,
        2296.32,
        2215.8,
        2241.04,
        2229.34,
        2246.31,
        2230.06,
        2201.1,
        2176.61,
        2196.34,
        2216.57,
        2252.96,
        2264.65,
        2293.18,
        2327.74,
        2339.14,
        2370.16,
        2388.0,
        2335.82,
        2344.38,
        2348.72,
        2303.68,
        2355.53,
        2336.07,
        2340.73,
        2360.97,
        2411.09,
        2377.64,
        2391.36,
        2384.55,
        2379.66,
        2382.33,
        2363.76,
        2335.28,
        2348.03,
        2400.88,
        2418.99,
        2394.93,
        2370.55,
        2367.92,
        2362.47,
        2375.56,
        2342.43,
        2353.92,
        2354.15,
        2347.24,
        2360.72,
        2354.74,
        2348.63,
        2373.51,
        2392.69,
        2378.37,
        2402.59,
        2412.05,
        2436.17,
        2390.48,
        2340.46,
        2348.16,
        2271.52,
        2277.41,
        2300.72,
        2293.3,
        2278.78,
        2287.77,
        2286.44,
        2288.11,
        2253.03,
        2235.14,
        2238.52,
        2249.53,
        2202.29,
        2258.02,
        2189.0,
        2179.87,
        2159.88,
        2137.66,
        2139.53,
        2128.09,
        2170.86,
        2189.96,
        2172.07,
        2186.66,
        2203.49,
        2212.34,
        2199.34,
        2172.51,
        2197.09,
        2225.97,
        2254.31,
        2255.75,
        2291.93,
        2308.54,
        2301.73,
        2263.19,
        2236.55,
        2246.0,
        2227.38,
        2251.61,
        2286.45,
        2300.94,
        2317.76,
        2343.49,
        2291.26,
        2270.03,
        2289.05,
        2349.8,
        2291.65,
        2213.49,
        2255.48,
        2322.38,
        2316.76,
        2291.85,
        2336.82,
        2304.21,
        2300.93,
        2285.39,
        2276.06,
        2282.39,
        2340.21,
        2287.62,
        2289.83,
        2240.0,
        2179.22,
        2157.24,
        2171.56,
        2196.1,
        2161.42,
        2184.08,
        2190.83,
        2182.02,
        2184.48,
        2197.45,
        2205.49,
        2182.42,
        2122.59,
        2092.49,
        1987.85,
        2045.52,
        2077.47,
        2044.52,
        2062.77,
        2055.78,
        2032.13,
        2042.75,
        1996.84,
        1951.94,
        1965.57,